{
  "schemaVersion": "1.4.0",
  "outline": {
    "id": "outline:light-delay-festival-master",
    "scriptId": "script:light-delay-festival-master",
    "title": {
      "es": "Escaleta — Lúz Tardía: Corte Festival derivado del master (WIP)",
      "en": "Outline — Light Delay: Master-derived Festival Cut (WIP)"
    },
    "synopsis": {
      "es": "En una misión improvisada de primer contacto, Zao descubre una bomba programada para el encuentro, logra enviar una advertencia hacia la posición futura de la Ardor y es asesinada por Harlan. Mientras él incrimina a Sorell y protege el vuelo automático, Elin separa las pruebas falsas de las verdaderas hasta que el mensaje demorado autentica la advertencia. La tripulación contiene a Harlan, demora sin desarmar la bomba y preserva el contacto; después, Voss envía a la Tierra un registro que reconoce que Zao llegó a tiempo.",
      "en": "During an improvised first-contact mission, Zao discovers a bomb timed for the encounter, manages to send a warning toward the Ardor’s future position, and is murdered by Harlan. As he frames Sorell and protects the automatic flight, Elin separates false explanations from real evidence until the delayed message authenticates the warning. The crew restrains Harlan, delays rather than disarms the bomb, and preserves contact; afterward, Voss sends Earth a record recognizing that Zao made it in time."
    },
    "status": "draft",
    "version": "0.2.0-wip",
    "revision": 1,
    "localization": {
      "sourceLanguage": "en",
      "translations": {
        "es": {
          "status": "needs_revision",
          "lastSyncedRevision": 1
        }
      }
    },
    "editorialNotice": {
      "es": "Derivado WIP autorizado contra el master rev. 19. El guion fuente en inglés cubre la escaleta; la traducción española, las tomas de producción, los takes, el animatic y los planes de generación no comenzaron.",
      "en": "WIP derivative authorized against master revision 19. Its English screenplay is drafted with complete outline coverage; Spanish translation, production shots, takes, animatic media, and generation plans have not started."
    },
    "derivation": {
      "sourceOutlineId": "outline:light-delay-master-narrative",
      "sourceRevision": 19,
      "sourceVersion": "0.8.0-wip",
      "relationship": "adaptation",
      "fidelity": "complete_causal_chain",
      "reviewStatus": "current"
    }
  },
  "framing": [
    {
      "id": "festival-master:framing-adaptation",
      "placement": "before_story",
      "order": 1,
      "kind": "purpose",
      "title": {
        "es": "Mandato de adaptación",
        "en": "Adaptation mandate"
      },
      "blocks": [
        {
          "type": "paragraph",
          "text": {
            "es": "Esta versión apunta a unos 12:43 tras extender las tomas cuya duración original no permitía un ritmo de habla natural; el objetivo original de 10–12 minutos se supera deliberadamente porque un diálogo entregable es en sí mismo una exigencia de legibilidad causal. Comprime los 58 hitos del master rev. 19 en una historia continua sin eliminar causas, motivaciones, falsas suposiciones ni consecuencias necesarias.",
            "en": "This version now targets approximately 12:43 after extending shots whose original duration did not allow a natural speaking pace; the original 10–12 minute target is deliberately exceeded because deliverable dialogue is itself a causal-readability requirement. It compresses all 58 beats of master revision 19 into a continuous story without removing necessary causes, motives, false assumptions, or consequences."
          }
        },
        {
          "type": "paragraph",
          "text": {
            "es": "La transmisión de Zao se ve pero su destinatario, contenido y mecanismo de intercepción permanecen ocultos hasta que el mensaje alcanza la nave. La compresión debe surgir del montaje, la acción simultánea y el diálogo funcional, no de reemplazar la continuidad por la del Festival anterior.",
            "en": "Zao’s transmission is seen, but its recipient, content, and interception mechanism remain hidden until the message reaches the ship. Compression must come from montage, simultaneous action, and functional dialogue, not by replacing this continuity with the earlier Festival version."
          }
        }
      ]
    }
  ],
  "storySections": [
    {
      "id": "festival-master:section-01",
      "order": 1,
      "title": {
        "es": "F01 — Tierra y partida",
        "en": "F01 — Earth and departure"
      }
    },
    {
      "id": "festival-master:section-02",
      "order": 2,
      "title": {
        "es": "F02 — Tránsito",
        "en": "F02 — Transit"
      }
    },
    {
      "id": "festival-master:section-03",
      "order": 3,
      "title": {
        "es": "F03 — Descubrimiento",
        "en": "F03 — Discovery"
      }
    },
    {
      "id": "festival-master:section-04",
      "order": 4,
      "title": {
        "es": "F04 — Aislamiento",
        "en": "F04 — Isolation"
      }
    },
    {
      "id": "festival-master:section-05",
      "order": 5,
      "title": {
        "es": "F05 — Advertencia y asesinato",
        "en": "F05 — Warning and murder"
      }
    },
    {
      "id": "festival-master:section-06",
      "order": 6,
      "title": {
        "es": "F06 — Incriminación",
        "en": "F06 — Frame-up"
      }
    },
    {
      "id": "festival-master:section-07",
      "order": 7,
      "title": {
        "es": "F07 — Investigación",
        "en": "F07 — Investigation"
      }
    },
    {
      "id": "festival-master:section-08",
      "order": 8,
      "title": {
        "es": "F08 — Revelación",
        "en": "F08 — Revelation"
      }
    },
    {
      "id": "festival-master:section-09",
      "order": 9,
      "title": {
        "es": "F09 — Persecución",
        "en": "F09 — Chase"
      }
    },
    {
      "id": "festival-master:section-10",
      "order": 10,
      "title": {
        "es": "F10 — Contacto",
        "en": "F10 — Contact"
      }
    },
    {
      "id": "festival-master:section-11",
      "order": 11,
      "title": {
        "es": "F11 — Registro",
        "en": "F11 — Record"
      }
    }
  ],
  "steps": [
    {
      "id": "festival-master:story-01",
      "level": "story",
      "sectionId": "festival-master:section-01",
      "order": 1,
      "title": {
        "es": "Una discusión que Voss interpreta mal",
        "en": "An argument Voss misreads"
      },
      "summary": {
        "es": "Con una demora de 43 MIN 18 S, la tripulación de Próxima observa protestas terrestres que enfrentan dos lecturas de la garganta y del encuentro irrepetible. Harlan teme una puerta alienígena que dicta condiciones sin responder; Sorell defiende contestar con cautela antes de juzgar. Voss confunde el temor de Harlan con esperanza y el rigor de Sorell con resistencia. Sólo después de oírla, Zao comprende el error y le advierte en privado: «Eso no era esperanza»; Voss descarta su inquietud.",
        "en": "Across a 43 MIN 18 S delay, the Proxima crew watches Earth protests divide over the throat and the once-in-millennia encounter. Harlan fears an alien door that dictates terms without answering; Sorell argues for a cautious reply before judgment. Voss mistakes Harlan’s dread for hope and Sorell’s rigor for reluctance. Only after hearing them does Zao recognize the error and warn him privately, “That wasn’t hope”; Voss dismisses her concern."
      },
      "importance": "required",
      "sourceRefs": [
        {
          "kind": "outline",
          "outlineId": "outline:light-delay-master-narrative",
          "stepId": "master:story-p1"
        },
        {
          "kind": "outline",
          "outlineId": "outline:light-delay-master-narrative",
          "stepId": "master:story-p2"
        }
      ],
      "coverage": {
        "script": {
          "status": "covered",
          "sceneIds": [
            "festival-master:scene-02",
            "festival-master:scene-03"
          ],
          "beatIds": [
            "festival-master:beat-02",
            "festival-master:beat-03"
          ],
          "cueIds": [
            "festival-master:cue-0002",
            "festival-master:cue-0003",
            "festival-master:cue-0004",
            "festival-master:cue-0005",
            "festival-master:cue-0006",
            "festival-master:cue-0007",
            "festival-master:cue-0008",
            "festival-master:cue-0009",
            "festival-master:cue-0010",
            "festival-master:cue-0011"
          ]
        }
      },
      "sceneIds": [
        "festival-master:scene-02",
        "festival-master:scene-03"
      ],
      "beatIds": [
        "festival-master:beat-02",
        "festival-master:beat-03"
      ],
      "cueIds": [
        "festival-master:cue-0002",
        "festival-master:cue-0003",
        "festival-master:cue-0004",
        "festival-master:cue-0005",
        "festival-master:cue-0006",
        "festival-master:cue-0007",
        "festival-master:cue-0008",
        "festival-master:cue-0009",
        "festival-master:cue-0010",
        "festival-master:cue-0011"
      ]
    },
    {
      "id": "festival-master:story-02",
      "level": "story",
      "sectionId": "festival-master:section-01",
      "order": 2,
      "title": {
        "es": "Partida apresurada y doble comprobación",
        "en": "Hurried departure and a second check"
      },
      "summary": {
        "es": "El cronograma exacto llegó demasiado tarde para traer diplomáticos desde la Tierra, así que la tripulación local prepara a toda prisa la Celestial Ardor. Voss llama «Commander» a Harlan y hace visible su autoridad sobre carga y preparación. Zao y Elin completan la revisión; Elin declara la nave lista, pero Zao repite el control desde otro ángulo antes de autorizar la partida. Su hábito, que Voss conoce y respeta, la deja revisando registros que otra persona habría cerrado.",